VerifyAdd,170092,165144,3 pc. LED Flocked Snowflakes,,"<html><head><meta http-equiv=""Content-Type"" content=""text/html;charset=utf-8"" /></head><body style=""font-family: Arial, Helvetica, sans-serif;""><div align=""center""><img src=""http://jamesmunsch.com/skygroup_test/p1p_1_88776_853759.jpg""></img></div><div align=""center""><b>Point One Premiums is Committed to Providing a Positive Experiencefor our Customers<br>______________________________________________________________________<br></b><b></b></div><div align=""center""><b><br></b></div><div align=""center""><b>Business Hours: M-F 9am - 5pm CST</b></div><p align=""center"">(Shipments &amp; Questions processed during Business Hours Only. Thanks.)</p><div align=""center""><b>____________________________________________________________________________</b></div><center><h1>3 pc. LED Flocked Snowflakes</h1></center><div align=""center""><br><a href=""http://50.244.213.181/0431-MEE2-C11-14-JM/4QA3250000010_A_999.JPEG""><img src=""http://50.244.213.181/0431-MEE2-C11-14-JM/4QA3250000010_A_999.JPEG"" height=""400"" width=""400"" ></a></br><div align=""left""><h4>Item normally retails for: 29.99</h4></div><div align=""left""<p><p> Decorate your home for the holidays with this set of 3 LEDlighted flocked snowflake ornaments.</p><ul> <li>  Includes 8 12 and 18 diam. ornaments in shatter-resistantplastic </li> <li>  Each uses AA battery (not included) </li></ul></p></div><div align=""left""><p><b><u>Auction Includes:</b></u><br><br><ul> <p><span style=""color:#a9a9a9;"">SKU: 0431-MEE2-C11-14-JM</span></p><div align=""center""><br>_________________________________________________________________________________<br></div><div align=""left""><b><u><br><br><br>SHIPPING :</u></b><ul><li>Items are shipped out Monday - Friday excluding Holidays.&nbsp; <br></li><li>Please expect up to 1 business day processing time for item to ship out.</li><li><b>Combined Shipping: </b>Please contact us before checkout for a revised invoice.</li><li>We DO NOT ship on the weekends.</li><li>We DO NOT ship outside of the US. and its territories</li></ul><b><u>CONTACT :</u></b>Point One Premiums welcomes you to contact us with any questions or concerns during our business hours.<br>(M-F 9am - 5pm CST) Any messages received outside of business hours will be processed the following business day.<br><br>Please use eBay's message system.<b><u><br></u></b><br><u><b>Return policy. </b></u><br><br>We offer a 14 day return policy. &nbsp;If you have any problems with the product please contact us right away to work out an exchange or refund.<br><br><b><u>Warranty Policy :</u></b><i><b><u><br><br></u></b></i><i style=""font-weight: bold;""></i>While some of our items are in New or Manufacturer Refurbished condition, <u>None</u> are implied to include a warranty. &nbsp;Some include a Manufacturer Warranty Card and it is between you and Manufacturer if that warranty is still valid. &nbsp;PointOnePremiums offers no warranties or&nbsp;guarantees&nbsp;of a warranty.<br><br><u><b>CANCELING TRANSACTIONS :</b></u><br><br>Due to a large number of bidders not following through on auctions we no longer cancel transactions.<br>All cancelled transactions charged a 15% restocking fee. <br><br><u><b>Unpaid Bidder Policy :</b></u><br><br>A case is opened for all auctions with unpaid bidders.<br>If you do not see something in the photos or detailed in the description as being included, do not assume it is included.&nbsp; <br><u><b><br>AS-IS and FOR PARTS/REPAIR :</b></u><br><br>Items listed AS-IS or FOR PARTS/REPAIR are non returnable and are not covered by our return policy.<br>We encourage buyers to contact us with any issues before opening a case with eBay.&nbsp; We will be happy to work with you to come to a satisfactory resolution.<br></div>    <div><br>    </div>    <div><br>    </div><br><div align=""center"">___________________________________________________________________________<br></div></body></html>",1000,Works like new. New in original packaging.. ,http://50.244.213.181/0431-MEE2-C11-14-JM/4QA3250000010_A_999.JPEG,1,Auction,.99,,,5,0,55406,Gallery,1,sales@skygroupcloseouts.com,"If you need a revised invoice for combined shipping, please contact us before paying so we can adjust the shipping costs.",,,,Flat,6.875,MN,1,0,55406,FedExHomeDelivery,12,1,10.00,1,0431-MEE2-C11-14-JM,ReturnsAccepted,MoneyBackOrExchange,Days_14,Buyer,"Please contact us before returning any item. Items listed AS-IS or For Parts/Repair are not covered by our return policy.  We offer 14 days to return item after receiving it. If item is defective we will supply return shipping label. Item must be returned in original packaging with all accessories included. We also charge a 15% restocking fee for cancelled transactions that are not shipped, or we let it go to eBay as an unpaid bidder case.  Do Not Bid If You Do Not Intend To Follow Through!",,,,US,0,0,0,0,0,1,100,5,2,Days_30,4,1,-1,1,,,,,,,,,,,,,,,,,,,,,,,,
VerifyAdd,20693,165144,Monogram 66 pc Stainless Flatware S Set,,"<html><head><meta http-equiv=""Content-Type"" content=""text/html;charset=utf-8"" /></head><body style=""font-family: Arial, Helvetica, sans-serif;""><div align=""center""><img src=""http://jamesmunsch.com/skygroup_test/p1p_1_88776_853759.jpg""></img></div><div align=""center""><b>Point One Premiums is Committed to Providing a Positive Experiencefor our Customers<br>______________________________________________________________________<br></b><b></b></div><div align=""center""><b><br></b></div><div align=""center""><b>Business Hours: M-F 9am - 5pm CST</b></div><p align=""center"">(Shipments &amp; Questions processed during Business Hours Only. Thanks.)</p><div align=""center""><b>____________________________________________________________________________</b></div><center><h1>Monogram 66 pc Stainless Flatware S Set</h1></center><div align=""center""><br><a href=""http://50.244.213.181/0480-MEE2-H61-64-JM/UC231_H_999.JPEG""><img src=""http://50.244.213.181/0480-MEE2-H61-64-JM/UC231_H_999.JPEG"" height=""400"" width=""400"" ></a></br><a href=""http://50.244.213.181/0480-MEE2-H61-64-JM/UC231_N_999.JPEG""><img src=""http://50.244.213.181/0480-MEE2-H61-64-JM/UC231_N_999.JPEG"" height=""400"" width=""400"" ></a></br><div align=""left""><h4>Item normally retails for: 69.99</h4></div><div align=""left""<p><p> This 66-pc. monogrammed flatware set is an outstandingvalue!</p><ul> <li>  Durable enough for everyday use and elegant enough for specialoccasions </li> <li>  Stainless steel service for 12 includes 12 each: dinner knifedinner fork salad fork tablespoon and teaspoon </li> <li>  Also includes hostess set with solid spoon slotted spoongravy ladle cold meat fork sugar shell and butter knife </li> <li>  Dishwasher safe;to prevent rusting it is recommended touse non-citrus detergent </li></ul></p></div><div align=""left""><p><b><u>Auction Includes:</b></u><br><br><ul> <p><span style=""color:#a9a9a9;"">SKU: 0480-MEE2-H61-64-JM</span></p><div align=""center""><br>_________________________________________________________________________________<br></div><div align=""left""><b><u><br><br><br>SHIPPING :</u></b><ul><li>Items are shipped out Monday - Friday excluding Holidays.&nbsp; <br></li><li>Please expect up to 1 business day processing time for item to ship out.</li><li><b>Combined Shipping: </b>Please contact us before checkout for a revised invoice.</li><li>We DO NOT ship on the weekends.</li><li>We DO NOT ship outside of the US. and its territories</li></ul><b><u>CONTACT :</u></b>Point One Premiums welcomes you to contact us with any questions or concerns during our business hours.<br>(M-F 9am - 5pm CST) Any messages received outside of business hours will be processed the following business day.<br><br>Please use eBay's message system.<b><u><br></u></b><br><u><b>Return policy. </b></u><br><br>We offer a 14 day return policy. &nbsp;If you have any problems with the product please contact us right away to work out an exchange or refund.<br><br><b><u>Warranty Policy :</u></b><i><b><u><br><br></u></b></i><i style=""font-weight: bold;""></i>While some of our items are in New or Manufacturer Refurbished condition, <u>None</u> are implied to include a warranty. &nbsp;Some include a Manufacturer Warranty Card and it is between you and Manufacturer if that warranty is still valid. &nbsp;PointOnePremiums offers no warranties or&nbsp;guarantees&nbsp;of a warranty.<br><br><u><b>CANCELING TRANSACTIONS :</b></u><br><br>Due to a large number of bidders not following through on auctions we no longer cancel transactions.<br>All cancelled transactions charged a 15% restocking fee. <br><br><u><b>Unpaid Bidder Policy :</b></u><br><br>A case is opened for all auctions with unpaid bidders.<br>If you do not see something in the photos or detailed in the description as being included, do not assume it is included.&nbsp; <br><u><b><br>AS-IS and FOR PARTS/REPAIR :</b></u><br><br>Items listed AS-IS or FOR PARTS/REPAIR are non returnable and are not covered by our return policy.<br>We encourage buyers to contact us with any issues before opening a case with eBay.&nbsp; We will be happy to work with you to come to a satisfactory resolution.<br></div>    <div><br>    </div>    <div><br>    </div><br><div align=""center"">___________________________________________________________________________<br></div></body></html>",1000,Works like new. New in original packaging.. ,http://50.244.213.181/0480-MEE2-H61-64-JM/UC231_N_999.JPEG,1,Auction,.99,,,5,0,55406,Gallery,1,sales@skygroupcloseouts.com,"If you need a revised invoice for combined shipping, please contact us before paying so we can adjust the shipping costs.",,,,Flat,6.875,MN,1,0,55406,FedExHomeDelivery,12,1,10.00,1,0480-MEE2-H61-64-JM,ReturnsAccepted,MoneyBackOrExchange,Days_14,Buyer,"Please contact us before returning any item. Items listed AS-IS or For Parts/Repair are not covered by our return policy.  We offer 14 days to return item after receiving it. If item is defective we will supply return shipping label. Item must be returned in original packaging with all accessories included. We also charge a 15% restocking fee for cancelled transactions that are not shipped, or we let it go to eBay as an unpaid bidder case.  Do Not Bid If You Do Not Intend To Follow Through!",,,,US,0,0,0,0,0,1,100,5,2,Days_30,4,1,-1,1,,,,,,,,,,,,,,,,,,,,,,,,
VerifyAdd,57989,165144,Carhartt Bib Overall   Black 36W 36L,,"<html><head><meta http-equiv=""Content-Type"" content=""text/html;charset=utf-8"" /></head><body style=""font-family: Arial, Helvetica, sans-serif;""><div align=""center""><img src=""http://jamesmunsch.com/skygroup_test/p1p_1_88776_853759.jpg""></img></div><div align=""center""><b>Point One Premiums is Committed to Providing a Positive Experiencefor our Customers<br>______________________________________________________________________<br></b><b></b></div><div align=""center""><b><br></b></div><div align=""center""><b>Business Hours: M-F 9am - 5pm CST</b></div><p align=""center"">(Shipments &amp; Questions processed during Business Hours Only. Thanks.)</p><div align=""center""><b>____________________________________________________________________________</b></div><center><h1>Carhartt Bib Overall   Black 36W 36L</h1></center><div align=""center""><br><a href=""http://50.244.213.181/2483-MEE2-H61-64-JM/N9103_400.JPEG""><img src=""http://50.244.213.181/2483-MEE2-H61-64-JM/N9103_400.JPEG"" height=""400"" width=""400"" ></a></br><div align=""left""><h4>Item normally retails for: 124.99</h4></div><div align=""left""<p>The toughest hardest working overalls you can buy.<ul> <li>  12-ounce heavy-duty cotton duck with 100% nylon quiltedpolyester midweight lining. </li> <li>  Includes zipper fly leg zippers that open to knee withprotective wind flap multiple tool and utility pockets and hammerloop. Triple-stitched main seams metal rivets at stress pointsand double knees to accommodate knee pads (with cleanoutbottom). </li> <li>  Machine wash. </li> <li>  Imported. </li></ul></p></div><div align=""left""><p><b><u>Auction Includes:</b></u><br><br><ul> <li>Carhartt Bib Black</li></ul></p></div><p><span style=""color:#a9a9a9;"">SKU: 2483-MEE2-H61-64-JM</span></p><div align=""center""><br>_________________________________________________________________________________<br></div><div align=""left""><b><u><br><br><br>SHIPPING :</u></b><ul><li>Items are shipped out Monday - Friday excluding Holidays.&nbsp; <br></li><li>Please expect up to 1 business day processing time for item to ship out.</li><li><b>Combined Shipping: </b>Please contact us before checkout for a revised invoice.</li><li>We DO NOT ship on the weekends.</li><li>We DO NOT ship outside of the US. and its territories</li></ul><b><u>CONTACT :</u></b>Point One Premiums welcomes you to contact us with any questions or concerns during our business hours.<br>(M-F 9am - 5pm CST) Any messages received outside of business hours will be processed the following business day.<br><br>Please use eBay's message system.<b><u><br></u></b><br><u><b>Return policy. </b></u><br><br>We offer a 14 day return policy. &nbsp;If you have any problems with the product please contact us right away to work out an exchange or refund.<br><br><b><u>Warranty Policy :</u></b><i><b><u><br><br></u></b></i><i style=""font-weight: bold;""></i>While some of our items are in New or Manufacturer Refurbished condition, <u>None</u> are implied to include a warranty. &nbsp;Some include a Manufacturer Warranty Card and it is between you and Manufacturer if that warranty is still valid. &nbsp;PointOnePremiums offers no warranties or&nbsp;guarantees&nbsp;of a warranty.<br><br><u><b>CANCELING TRANSACTIONS :</b></u><br><br>Due to a large number of bidders not following through on auctions we no longer cancel transactions.<br>All cancelled transactions charged a 15% restocking fee. <br><br><u><b>Unpaid Bidder Policy :</b></u><br><br>A case is opened for all auctions with unpaid bidders.<br>If you do not see something in the photos or detailed in the description as being included, do not assume it is included.&nbsp; <br><u><b><br>AS-IS and FOR PARTS/REPAIR :</b></u><br><br>Items listed AS-IS or FOR PARTS/REPAIR are non returnable and are not covered by our return policy.<br>We encourage buyers to contact us with any issues before opening a case with eBay.&nbsp; We will be happy to work with you to come to a satisfactory resolution.<br></div>    <div><br>    </div>    <div><br>    </div><br><div align=""center"">___________________________________________________________________________<br></div></body></html>",1000,Works like new. New in original packaging.. ,http://50.244.213.181/2483-MEE2-H61-64-JM/N9103_400.JPEG,1,Auction,.99,,,5,0,55406,Gallery,1,sales@skygroupcloseouts.com,"If you need a revised invoice for combined shipping, please contact us before paying so we can adjust the shipping costs.",,,,Flat,6.875,MN,1,0,55406,FedExHomeDelivery,12,1,10.00,1,2483-MEE2-H61-64-JM,ReturnsAccepted,MoneyBackOrExchange,Days_14,Buyer,"Please contact us before returning any item. Items listed AS-IS or For Parts/Repair are not covered by our return policy.  We offer 14 days to return item after receiving it. If item is defective we will supply return shipping label. Item must be returned in original packaging with all accessories included. We also charge a 15% restocking fee for cancelled transactions that are not shipped, or we let it go to eBay as an unpaid bidder case.  Do Not Bid If You Do Not Intend To Follow Through!",,,,US,0,0,0,0,0,1,100,5,2,Days_30,4,1,-1,1,,,,,,,,,,,,,,,,,,,,,,,,
VerifyAdd,170092,165144,MyHome 4ft Lighted Gold Christmas Tree Decor,,"<html><head><meta http-equiv=""Content-Type"" content=""text/html;charset=utf-8"" /></head><body style=""font-family: Arial, Helvetica, sans-serif;""><div align=""center""><img src=""http://jamesmunsch.com/skygroup_test/p1p_1_88776_853759.jpg""></img></div><div align=""center""><b>Point One Premiums is Committed to Providing a Positive Experiencefor our Customers<br>______________________________________________________________________<br></b><b></b></div><div align=""center""><b><br></b></div><div align=""center""><b>Business Hours: M-F 9am - 5pm CST</b></div><p align=""center"">(Shipments &amp; Questions processed during Business Hours Only. Thanks.)</p><div align=""center""><b>____________________________________________________________________________</b></div><center><h1>MyHome 4ft Lighted Gold Christmas Tree Decor</h1></center><div align=""center""><br><a href=""http://50.244.213.181/0458-MEE2-H61-64-JM/4QA1640000010_A_999.JPEG""><img src=""http://50.244.213.181/0458-MEE2-H61-64-JM/4QA1640000010_A_999.JPEG"" height=""400"" width=""400"" ></a></br><a href=""http://50.244.213.181/0458-MEE2-H61-64-JM/4QA1640000010_B_999.JPEG""><img src=""http://50.244.213.181/0458-MEE2-H61-64-JM/4QA1640000010_B_999.JPEG"" height=""400"" width=""400"" ></a></br><div align=""left""><h4>Item normally retails for: 99.99</h4></div><div align=""left""<p><p> MyHome 4' lighted gold sequin Christmas tree brightens your yardthroughout the holidays.</p><ul> <li>  Gold sequin tree is lit with 70 mini lights </li> <li>  Adorned with red tinsel fabric bow </li> <li>  15W x 3D x 48H </li> <li>  Includes spare bulbs and fuses support ropes and groundanchors </li> <li>  36 power cord is UL listed </li></ul></p></div><div align=""left""><p><b><u>Auction Includes:</b></u><br><br><ul> <p><span style=""color:#a9a9a9;"">SKU: 0458-MEE2-H61-64-JM</span></p><div align=""center""><br>_________________________________________________________________________________<br></div><div align=""left""><b><u><br><br><br>SHIPPING :</u></b><ul><li>Items are shipped out Monday - Friday excluding Holidays.&nbsp; <br></li><li>Please expect up to 1 business day processing time for item to ship out.</li><li><b>Combined Shipping: </b>Please contact us before checkout for a revised invoice.</li><li>We DO NOT ship on the weekends.</li><li>We DO NOT ship outside of the US. and its territories</li></ul><b><u>CONTACT :</u></b>Point One Premiums welcomes you to contact us with any questions or concerns during our business hours.<br>(M-F 9am - 5pm CST) Any messages received outside of business hours will be processed the following business day.<br><br>Please use eBay's message system.<b><u><br></u></b><br><u><b>Return policy. </b></u><br><br>We offer a 14 day return policy. &nbsp;If you have any problems with the product please contact us right away to work out an exchange or refund.<br><br><b><u>Warranty Policy :</u></b><i><b><u><br><br></u></b></i><i style=""font-weight: bold;""></i>While some of our items are in New or Manufacturer Refurbished condition, <u>None</u> are implied to include a warranty. &nbsp;Some include a Manufacturer Warranty Card and it is between you and Manufacturer if that warranty is still valid. &nbsp;PointOnePremiums offers no warranties or&nbsp;guarantees&nbsp;of a warranty.<br><br><u><b>CANCELING TRANSACTIONS :</b></u><br><br>Due to a large number of bidders not following through on auctions we no longer cancel transactions.<br>All cancelled transactions charged a 15% restocking fee. <br><br><u><b>Unpaid Bidder Policy :</b></u><br><br>A case is opened for all auctions with unpaid bidders.<br>If you do not see something in the photos or detailed in the description as being included, do not assume it is included.&nbsp; <br><u><b><br>AS-IS and FOR PARTS/REPAIR :</b></u><br><br>Items listed AS-IS or FOR PARTS/REPAIR are non returnable and are not covered by our return policy.<br>We encourage buyers to contact us with any issues before opening a case with eBay.&nbsp; We will be happy to work with you to come to a satisfactory resolution.<br></div>    <div><br>    </div>    <div><br>    </div><br><div align=""center"">___________________________________________________________________________<br></div></body></html>",1000,Works like new. New in original packaging.. ,http://50.244.213.181/0458-MEE2-H61-64-JM/4QA1640000010_B_999.JPEG,1,Auction,.99,,,5,0,55406,Gallery,1,sales@skygroupcloseouts.com,"If you need a revised invoice for combined shipping, please contact us before paying so we can adjust the shipping costs.",,,,Flat,6.875,MN,1,0,55406,FedExHomeDelivery,12,1,10.00,1,0458-MEE2-H61-64-JM,ReturnsAccepted,MoneyBackOrExchange,Days_14,Buyer,"Please contact us before returning any item. Items listed AS-IS or For Parts/Repair are not covered by our return policy.  We offer 14 days to return item after receiving it. If item is defective we will supply return shipping label. Item must be returned in original packaging with all accessories included. We also charge a 15% restocking fee for cancelled transactions that are not shipped, or we let it go to eBay as an unpaid bidder case.  Do Not Bid If You Do Not Intend To Follow Through!",,,,US,0,0,0,0,0,1,100,5,2,Days_30,4,1,-1,1,,,,,,,,,,,,,,,,,,,,,,,,
